Date,Source,Original_Tweet,Cleaned_Tweet,Similarity_Score,Original_Length,Cleaned_Length,Length_Difference
2023-04-08 03:32:16+00:00,ChatGPT,"Workshop Description: In this workshop, you will learn how to use ChatGPT, an advanced AI language model, to generate creative ideas and solve problems in your innovation projects.

Read more 👉 https://t.co/C6KVmloTo0

#ChatGPT #AI #Learning https://t.co/5FdrMCDcGQ","workshop description: workshop, learn use chatgpt, advanced ai language model, generate creative ideas solve problems innovation projects. read",0.5294117647058824,265,143,122
2023-04-08 03:26:16+00:00,ChatGPT,"Gugenka team has created a fun Customize new plugin for #ChatGPT x #Hubs that also work with #MozillaHubs and Hubs based platforms 🎉🎊🥳
- ChatGPT compatible 
- Humanoid Avatar Support
- Voice generation
- Facial reactions
- Lip sync
- Animation respond
 
#webvr #xr #socialvr… https://t.co/WnmrJS3p9g",gugenka team created fun customize new plugin x also work hubs based platforms chatgpt compatible humanoid avatar support voice generation facial reactions lip sync animation respond,0.6341463414634146,299,182,117
2023-04-08 03:22:03+00:00,ChatGPT,"Share tweets with my free chat GPT, Telegram bot:  https://xtweets.ioand get inspired with cool replies and Tweets!  #chatGPT #tweets #AI #free #Twitterbot","share tweets free chat gpt, telegram bot: get inspired cool replies tweets!",0.5714285714285714,155,75,80
2023-04-08 03:22:02+00:00,ChatGPT,🌟 Enhance your business with cutting-edge AI technology! Our #ChatGPT for Beginners course offers the perfect introduction for companies embracing the digital world. Sign up now: https://t.co/kAF7l0d2qN #BusinessInnovation #AI https://t.co/mr9mfv7hmI,enhance business cuttingedge ai technology! beginners course offers perfect introduction companies embracing digital world. sign now:,0.5172413793103449,250,133,117
2023-04-08 03:19:40+00:00,ChatGPT,"Germany considers ChatGPT ban https://t.co/d7ovmZxQNK 

#AI #ChatGPT",germany considers chatgpt ban,0.5714285714285714,68,29,39
2023-04-08 03:16:24+00:00,ChatGPT,"well, #ChatGPT made me change my idea of not giving titles &amp; desc to artwork.

as it solves my problems with english vocabulary.

now i give it my thoughts in gibberish english &amp; mix of Tamil. then we argue with each other till i get desired result
i get
- knowledge
- Description","well, made change idea giving titles amp; desc artwork. solves problems english vocabulary. give thoughts gibberish english amp; mix tamil. argue till get desired result get knowledge description",0.5581395348837209,288,195,93
2023-04-08 03:08:17+00:00,ChatGPT,"Stanford university students create CHAT GPT 4 ar glasses! 💥

Would you try this?
.
Do not forget to like, comment and share! 
Source- Google 

#chatgpt #ai #entrepreneurshipfacts #entrepreneurshipmindset #businesstips101 #businessmotivation #businesspassion #businessinsider https://t.co/qiBWSnFwBx","stanford university students create chat gpt 4 ar glasses! would try this? . forget like, comment share! source google",0.5142857142857142,299,118,181
2023-04-08 03:06:35+00:00,ChatGPT,"#ChatGPT 4 is damn near useless still, and guys like #ElonMusk don't want further #AI progress. We are very far from artificial general intelligence based on how useless ChatGPT still is for practical use. It is good as a virtual chat buddy however.
I do agree however 1/2","4 damn near useless still, guys like want progress. far artificial general intelligence based useless chatgpt still practical use. good virtual chat buddy however. agree however 12",0.5434782608695652,272,180,92
2023-04-08 03:04:13+00:00,ChatGPT,"I just wanted to time how long GPT3.5 took to create a 4000 word response, versus #GPT4 took to create a 8000 word response, but alas ""safety"" got in the way. #chatGPT https://t.co/au04WWXdxw","wanted time long gpt3.5 took create 4000 word response, versus took create 8000 word response, alas safety got way.",0.5185185185185185,191,115,76
2023-04-08 02:53:23+00:00,ChatGPT,"Evaluation of takeover :
- Human uses animals to gain power.
- Human uses machines to gain power.
- Animals not required anymore!
- Human uses AI to gain power and degree! 
- AI uses human by giving power and degree.
- Human not required anymore..

#AI
#OpenAI 
#ChatGPT
#Bard",evaluation takeover : human uses animals gain power. human uses machines gain power. animals required anymore! human uses ai gain power degree! ai uses human giving power degree. human required anymore,0.5714285714285714,276,201,75
2023-04-08 02:47:33+00:00,ChatGPT,"Discover your ant society role based on your job! Unleash your inner ant and join the fun! 🐜✨
#ChatGPT
https://t.co/ikQWis6yrq",discover ant society role based job! unleash inner ant join fun!,0.5882352941176471,126,64,62
2023-04-08 02:46:34+00:00,ChatGPT,Google Bard is as good or perhaps better than ChatGPT for breaking down concepts to a simpler form. I love that it gives you three drafts in one go #GoogleBard #ChatGPT,google bard good perhaps better chatgpt breaking concepts simpler form. love gives three drafts one go,0.5161290322580645,168,102,66
2023-04-08 02:43:45+00:00,ChatGPT,"The rise of the fantastic #ChatGPT gives everyone access to powers and abilities, the likes of which this world has never seen before. Use it wisely!","rise fantastic gives everyone access powers abilities, likes world never seen before. use wisely!",0.6086956521739131,149,97,52
2023-04-08 02:36:23+00:00,ChatGPT,"@BladeoftheS Public servants apparently.  Wonder how long before AI can replace politicians by actually serving the population.
#ChatGPT #ai #brokenpolitics",public servants apparently. wonder long ai replace politicians actually serving population.,0.55,156,91,65
2023-04-08 02:36:03+00:00,ChatGPT,🌟 Enhance your business with cutting-edge AI technology! Our #ChatGPT for Beginners course offers the perfect introduction for companies embracing the digital world. Sign up now: https://t.co/kAF7l0d2qN #BusinessInnovation #AI https://t.co/QtDlwcnR8H,enhance business cuttingedge ai technology! beginners course offers perfect introduction companies embracing digital world. sign now:,0.5172413793103449,250,133,117
2023-04-08 02:34:37+00:00,ChatGPT,"#DYK that #Samsung employees learned things the hard way when they leaked confidential company secret when they used #OpenAI's #ChatGPT for work?

Once information is sent for the #AI to learn, it's impossible for anyone to retrieve the information.

https://t.co/ofKLWxjU9K https://t.co/0PZqTRH5LN","employees learned things hard way leaked confidential company secret used work? information sent learn, impossible anyone retrieve information.",0.5294117647058824,298,143,155
2023-04-08 02:30:08+00:00,ChatGPT,"People AI is here , login to chatGPT and start asking it religious , historical and constitutional questions. Don’t believe a word that anyone say on social media #ChatGPT #الیکشن_تو_ہوگا #GoHomeBandiyal","people ai , login chatgpt start asking religious , historical constitutional questions. dont believe word anyone say social media",0.5666666666666667,203,129,74
2023-04-08 02:29:42+00:00,ChatGPT,"Top 3 Tech Daily News: Save 8 hours using ChatGPT prompts, Employees will reduce pay 18% for remote work, Apple store robbed of 436 iphones #chatgpt #remote #apple #robbery https://t.co/pxnOiKSs0a","top 3 tech daily news: save 8 hours using chatgpt prompts, employees reduce pay 18 remote work, apple store robbed 436 iphones",0.6774193548387096,196,126,70
2023-04-08 02:23:24+00:00,ChatGPT,"I’m old enough to remember when English teachers were pissed that we could level up our essays using MS Word Thesaurus. “Don’t just select random words and make them fancy. I can tell.” 

#ChatGPT lol lmao",im old enough remember english teachers pissed could level essays using ms word thesaurus. dont select random words make fancy. tell. lol lmao,0.5128205128205128,205,142,63
2023-04-08 02:20:53+00:00,ChatGPT,"Discover how one user employs ChatGPT as a coach to maintain discipline and stay on track while juggling daily tasks and making important decisions. #AI #ChatGPT #DailyLife #Balance #Coaching #Discipline #OpenAI

https://t.co/gRC99u72Xn",discover one user employs chatgpt coach maintain discipline stay track juggling daily tasks making important decisions.,0.5161290322580645,236,119,117
2023-04-08 02:19:26+00:00,ChatGPT,"ChatGPT is powerful and so good to use as a starter for our content marketing. But if you want to grow following of people who see you as the expert, avoid using chat got to write your contebt unkess you are going to edit it to add your voice after. #chatgpt #chatgpt3 #smallbu https://t.co/YYTJHLwON0","chatgpt powerful good use starter content marketing. want grow following people see expert, avoid using chat got write contebt unkess going edit add voice after.",0.5434782608695652,301,161,140
2023-04-08 02:17:48+00:00,ChatGPT,#ProgenyProgram #ChatGPT ChatGpt tell 50 test before marriage #marriage . https://t.co/1snJ8mjszo,chatgpt tell 50 test marriage .,0.5454545454545454,97,31,66
2023-04-08 02:14:08+00:00,ChatGPT,#MedTwitter someone fed #ChatGPT with MKSAP19. It answers everything correct with same references. It will be interesting to see how it will do with ABIM's Longitudinal Knowledge Assessment questions.,someone fed mksap19. answers everything correct references. interesting see abims longitudinal knowledge assessment questions.,0.52,200,126,74
2023-04-08 02:13:54+00:00,ChatGPT,"hmm, if I was using the api instead of #chatgpt interface it would be easy to kick off multiple things at once?

have a chat to spec out enough about how it works, then kick off multiple concurrent generations for different files?","hmm, using api instead interface would easy kick multiple things once? chat spec enough works, kick multiple concurrent generations different files?",0.5135135135135135,230,148,82
2023-04-08 02:12:22+00:00,ChatGPT,4. AI-powered tools like #ChatGPT can help individuals explore their genomic data while maintaining privacy and control over their genetic information. https://t.co/IAZgvU54UI,4. aipowered tools like help individuals explore genomic data maintaining privacy control genetic information.,0.5909090909090909,175,110,65
2023-04-08 02:11:12+00:00,ChatGPT,"Top 10 Keypoints: 🧵
1. AI chatbots like #ChatGPT and #BioGPT are transforming healthcare and #genomics by assisting humans in interpreting vast amounts of genetic data.",top 10 keypoints: 1. ai chatbots like transforming healthcare assisting humans interpreting vast amounts genetic data.,0.64,168,118,50
2023-04-08 02:08:01+00:00,ChatGPT,"Tip: When using #chatgpt to create a prompt for a program to enhance customer loyalty and retention, try including specific incentives or rewards that will motivate customers to stay loyal to your brand. #customerloyalty #retentionstrategy","tip: using create prompt program enhance customer loyalty retention, try including specific incentives rewards motivate customers stay loyal brand.",0.6129032258064516,239,147,92
2023-04-08 02:03:50+00:00,ChatGPT,"The #ChatGPT bot
knows #Bullion and is not
delusional telling you to go speculate
in nonsense rather, lock a large portion of
your liquid net worth in physical precious metals: 

https://t.co/WvjcNF6fhF","bot knows delusional telling go speculate nonsense rather, lock large portion liquid net worth physical precious metals:",0.5666666666666667,202,120,82
2023-04-08 02:02:44+00:00,ChatGPT,"wow look at the lawyering #chatgpt can do:

so it hallucinated Icelandic mythology of a fake legendary object into a D&amp;D item card, and then compared differences in spell properties: https://t.co/tnbfowXpQ1","wow look lawyering do: hallucinated icelandic mythology fake legendary object damp;d item card, compared differences spell properties:",0.5161290322580645,210,134,76
2023-04-08 02:00:58+00:00,ChatGPT,"@WarrenHailes It does if you live within its borders and are their open air prison s1av3, dear ser I plan on catching no felonies.

Got #ChatGPT as one of my shields, helping me not miss such pesky details that would serve to criminalize me.","live within borders open air prison s1av3, dear ser plan catching felonies. got one shields, helping miss pesky details would serve criminalize me.",0.5227272727272727,241,147,94
2023-04-08 01:55:35+00:00,ChatGPT,"My political and economical views are changing right now, due to #ChatGPT.

Most important for me was always progress. More productivity, science, technology. For various reasons. One important point though has always been my tendency to think utilitarian.

Progress solves much… https://t.co/ffTw0velbO","political economical views changing right now, due important always progress. productivity, science, technology. various reasons. one important point though always tendency think utilitarian. progress solves much",0.6052631578947368,303,212,91
2023-04-08 01:54:19+00:00,ChatGPT,#ChatGPT couldn’t solve simple Linux frame buffer issues using fbset. How does anyone find use in it?,couldnt solve simple linux frame buffer issues using fbset. anyone find use it?,0.6666666666666666,101,79,22
2023-04-08 01:52:04+00:00,ChatGPT,🌟 Enhance your business with cutting-edge AI technology! Our #ChatGPT for Beginners course offers the perfect introduction for companies embracing the digital world. Sign up now: https://t.co/kAF7l0d2qN #BusinessInnovation #AI https://t.co/wAGw4KNFFM,enhance business cuttingedge ai technology! beginners course offers perfect introduction companies embracing digital world. sign now:,0.5172413793103449,250,133,117
2023-04-08 01:50:06+00:00,ChatGPT,"""Overall, the story of Náglablót and the sword hilt with the power to reveal truth has inspired many works of modern fiction and has become a powerful symbol of wisdom, justice, and heroism."" 

#chatgpt #DnD5e item card: https://t.co/xBHESNK9Cv","overall, story nglablt sword hilt power reveal truth inspired many works modern fiction become powerful symbol wisdom, justice, heroism. item card:",0.5294117647058824,244,147,97
2023-04-08 01:49:51+00:00,ChatGPT,"@obie @brykman @romanklis @romanklis I used your #ChatGPT #MUD game prompt but I went north to peek in the door. What I got back was, ""You approach the door to the east and peek inside. You see a dimly lit room with torture devices hanging on the walls."" #ThisJustGotReal https://t.co/jKsh2L2mSS","used game prompt went north peek door. got back was, you approach door east peek inside. see dimly lit room torture devices hanging walls.",0.5116279069767442,295,138,157
2023-04-08 01:47:45+00:00,ChatGPT,"I heard a clip of @benshapiro speaking about #AI and #ChatGPT today. It was a brilliant distillation of human value: AI can’t feed of itself. It requires inputs. Jobs that focus on inputs have value. 

Expert content = input 
Non-expert content ≠ irrelevance.",heard clip speaking today. brilliant distillation human value: ai cant feed itself. requires inputs. jobs focus inputs value. expert content input nonexpert content irrelevance.,0.525,259,177,82
2023-04-08 01:46:35+00:00,ChatGPT,Relax guys Universal Basic Income is coming soon thanks to #ChatGPT,relax guys universal basic income coming soon thanks,0.7272727272727273,67,52,15
2023-04-08 01:42:45+00:00,ChatGPT,"Been to busy worldbuilding a time system in #ChatGPT today to do any MJ prompting. What's even better is that it produced a step-by-step how to guide to create this clock like device, called a Celestior, used to track the 4 moons and 2 suns of Eskus. https://t.co/MBrK5mQ0tq","busy worldbuilding time system today mj prompting. whats even better produced stepbystep guide create clock like device, called celestior, used track 4 moons 2 suns eskus.",0.5454545454545454,274,171,103
2023-04-08 01:41:55+00:00,ChatGPT,".@Microsoft just gutted the entire team protecting us from the ethical dangers of #ChatGPT.  Unless we take action now, the next disinformation nightmare could be unleashed. Sign the petition: https://t.co/JAkgchWa81",". gutted entire team protecting us ethical dangers unless take action now, next disinformation nightmare could unleashed. sign petition:",0.6428571428571429,216,136,80
2023-04-08 01:41:00+00:00,ChatGPT,"We need pirate AIs. Open-sourced and operated from unreachable places in the US, for example, the Tor Network. This technology brings another industrial revolution and must not be controlled by the woke.

#ChatGPT #OpenAI #AI #ArtificialIntelligence","need pirate ais. opensourced operated unreachable places us, example, tor network. technology brings another industrial revolution must controlled woke.",0.5294117647058824,249,152,97
2023-04-08 01:37:50+00:00,ChatGPT,Sometimes learning is fun. Made a little digital kids book while learning more about AI. All the new innovation happening is pretty cool… at least in my opinion. #ChatGPT https://t.co/uklGFt7uSg,sometimes learning fun. made little digital kids book learning ai. new innovation happening pretty cool least opinion.,0.5172413793103449,194,118,76
2023-04-08 01:37:29+00:00,ChatGPT,"I'm looking to do some free graphic design work to help get my name out there, if anyone wants anything done, feel free to DM me! #freelance #graphicdesign #graphicdesigner #design #designer #ChatGPT #promotion","looking free graphic design work help get name there, anyone wants anything done, feel free dm me!",0.5333333333333333,210,98,112
2023-04-08 01:31:07+00:00,ChatGPT,ChatGPT faces defamation lawsuit over false claims against an Australian mayor. Details here: https://t.co/z5vF9oGbif #ChatGPT #Defamation #AI url,chatgpt faces defamation lawsuit false claims australian mayor. details here: url,0.6111111111111112,146,81,65
2023-04-08 01:28:41+00:00,ChatGPT,"Singular: A SudoLang Text Adventure.

* Programmed in SudoLang, a natural language, functional, constraint-based programming language
* Tracks inventory and quests with constraint-based programming.

#ChatGPT #GPT4 #AI https://t.co/xfKWAISenI","singular: sudolang text adventure. programmed sudolang, natural language, functional, constraintbased programming language tracks inventory quests constraintbased programming.",0.5769230769230769,242,175,67
2023-04-08 01:22:38+00:00,ChatGPT,"Before ChatGPT becomes a data privacy nightmare, govt regulations must tame it #ChatGPT #AI #OpenAI #Microsoft https://t.co/NZVsOkuY72","chatgpt becomes data privacy nightmare, govt regulations must tame",0.5294117647058824,134,66,68
2023-04-08 01:21:16+00:00,ChatGPT,"@AtmanAcademy Day 71 of #100DaysOfChatGPT; exploring, experimenting and growing through interactions with #ChatGPT.

If this content inspires you, please: Comment/Like/Retweet/Follow.

GRAB THE CHEAT SHEET from the ChatGPT workshop here:

https://t.co/8cux5umftt

Hop on in!

👀🕳️🐇","day 71 exploring, experimenting growing interactions content inspires you, please: commentlikeretweetfollow. grab cheat sheet chatgpt workshop here: hop in!",0.5294117647058824,280,156,124
2023-04-08 01:15:22+00:00,ChatGPT,Today my team is released a product called https://t.co/oirlJYCTn8 -- an app where you can upload a PDF and begin chatting with it. The goal is to help companies automate their FAQs and reduce the pain of building and managing customer support documentation. #ChatGPT #GPT4,today team released product called app upload pdf begin chatting it. goal help companies automate faqs reduce pain building managing customer support documentation.,0.575,273,164,109
2023-04-08 01:14:38+00:00,ChatGPT,"How ChatGPT Could Revolutionize Academia The AI chatbot could enhance learning, but also creates some challenges.
#AI #academia #chatbot #ChatGPT 
https://t.co/H7ThLH0hSl","chatgpt could revolutionize academia ai chatbot could enhance learning, also creates challenges.",0.55,170,96,74
2023-04-08 01:10:35+00:00,ChatGPT,"A Primary Poll that shows 3 people NOT officially in the RUN 4 the Presidency, Yea, that shows some credibility in this nonsense. Like I've said B4, put @elonmusk or #ChatGPT in the mix 4 some entertainment as this Poll aims 2 B 4, heck put #HunterBiden in the pot! Vivek &amp; Haley! https://t.co/tveZTc83lV","primary poll shows 3 people officially run 4 presidency, yea, shows credibility nonsense. like said b4, put mix 4 entertainment poll aims 2 b 4, heck put pot! vivek amp; haley!",0.6190476190476191,308,176,132
2023-04-08 01:09:27+00:00,ChatGPT,"#ChatGPT #GPT4 3 Key Prompt Engineering Considerations for Today's LLMs: 1. They can READ text faster than can generate tokens, 2. LLMS have limited memory, 3. LLMs have limited online learning ability if can do it, at all (limited by memory) #PromptEngineer","3 key prompt engineering considerations todays llms: 1. read text faster generate tokens, 2. llms limited memory, 3. llms limited online learning ability it, limited memory",0.5384615384615384,258,172,86
2023-04-08 01:09:01+00:00,ChatGPT,"My deep dive into whether OpenAI 's #ChatGPT plugin store could reach #AppStore monopoly status like Apple! 🍏

Key points to consider:
🚧 Distribution Exclusivity
📱 App Exclusivity
🌐 Network Effects

But, is monopoly even the right goal? 🎯💡

https://t.co/f3Xvo0iUKY","deep dive whether openai s plugin store could reach monopoly status like apple! key points consider: distribution exclusivity app exclusivity network effects but, monopoly even right goal?",0.6153846153846154,264,188,76
2023-04-08 01:06:04+00:00,ChatGPT,"🚀 Introducing ChatGDB .com - Revolutionize Your Debugging Experience! 🚀

🤖 Harness the power of #ChatGPT inside the GDB debugger with ChatGDB! Debug faster and smarter, letting ChatGPT assist you every step of the way.

💡 Explain in natural language what you want to do, and…","introducing chatgdb .com revolutionize debugging experience! harness power inside gdb debugger chatgdb! debug faster smarter, letting chatgpt assist every step way. explain natural language want do, and",0.6585365853658537,275,202,73
2023-04-08 01:05:03+00:00,ChatGPT,🌟 Enhance your business with cutting-edge AI technology! Our #ChatGPT for Beginners course offers the perfect introduction for companies embracing the digital world. Sign up now: https://t.co/kAF7l0d2qN #BusinessInnovation #AI https://t.co/bhXJAmjyKq,enhance business cuttingedge ai technology! beginners course offers perfect introduction companies embracing digital world. sign now:,0.5172413793103449,250,133,117
2023-04-08 01:04:42+00:00,ChatGPT,"I appreciate the wonder and delight of #ChatGPT but I still need to make the family dinner after a long, hard week.","appreciate wonder delight still need make family dinner long, hard week.",0.55,115,72,43
2023-04-08 01:00:01+00:00,ChatGPT,"Create unique and realistic onigiri designs with a touch of creativity. Use high-quality ingredients and consider playful shapes and patterns. Bring your vision to life with attention to detail
#midjourney #ChatGPT https://t.co/cvmFcvGvlY",create unique realistic onigiri designs touch creativity. use highquality ingredients consider playful shapes patterns. bring vision life attention detail,0.6206896551724138,238,154,84
2023-04-08 00:59:00+00:00,ChatGPT,"#ChatGPT Powered A.I App generates Engaging Text, Voiceovers, &amp; Video at lightning-fast speed and unmatched accuracy! https://t.co/9e2GGM3Ljj https://t.co/S78wtbMNHL","powered a.i app generates engaging text, voiceovers, amp; video lightningfast speed unmatched accuracy!",0.55,169,103,66
2023-04-08 00:55:10+00:00,ChatGPT,10/20 💬 Encourage creative thinking by asking #ChatGPT to brainstorm ideas or imagine scenarios. This can help you generate unique solutions or explore new possibilities. #GPT4 #AIcreativity,1020 encourage creative thinking asking brainstorm ideas imagine scenarios. help generate unique solutions explore new possibilities.,0.5555555555555556,190,133,57
2023-04-08 00:54:14+00:00,ChatGPT,"BTC saw red for a second session on Friday, with rising bets of a Fed interest rate hike in May weighing. Capitol Hill remains another headwind. #BTC #Bitcoin #CryptoNews #cryptomarket #ChatGPT #openai Sentiment Result : Negative @crypto_talkies https://t.co/3UpFibkpsq","btc saw red second session friday, rising bets fed interest rate hike may weighing. capitol hill remains another headwind. sentiment result : negative",0.6216216216216216,269,150,119
2023-04-08 00:51:57+00:00,ChatGPT,"Italy banned ChatGPT, the first known instance of the chatbot being blocked by a Western government.

Click below:
https://t.co/OQ2PB4RMHD

#irfanmalik #ChatGPT #OpenAI #xevenai #xevensolutions","italy banned chatgpt, first known instance chatbot blocked western government. click below:",0.5217391304347826,193,91,102
2023-04-08 00:50:58+00:00,ChatGPT,"The newest version of ChatGPT passed the US medical licensing exam with flying colors — and diagnosed a 1 in 100,000 condition in seconds https://t.co/o6qp3bOWrD via @thisisinsider #OpenAI #ChatGPT #GPT4","newest version chatgpt passed us medical licensing exam flying colors diagnosed 1 100,000 condition seconds via",0.5714285714285714,203,111,92
2023-04-08 00:50:42+00:00,ChatGPT,"Hey #ChatGPT, give me 5 words that rhyme with trigger",hey give 5 words rhyme trigger,0.6,53,30,23
2023-04-08 00:46:16+00:00,ChatGPT,"I asked #ChatGPT about #asperger.
I found out you learn to live with it.
Also people understand it's a different way of thinking.

We are normal, but wired 2.0. Thinking ahead. https://t.co/2kvM7AW5lg","asked found learn live it. also people understand different way thinking. normal, wired 2.0. thinking ahead.",0.5161290322580645,200,108,92
