Date,Source,Original_Tweet,Cleaned_Tweet,Similarity_Score,Original_Length,Cleaned_Length,Length_Difference
2023-04-08 00:41:27+00:00,ChatGPT,"@LuxAlptraum ""a Barbie doll had exposed the absurdity and the beauty of the human condition. He had become a symbol of the idealized beauty, gender stereotypes, and consumer culture that Barbie dolls represent, and he loved every minute of it.""

#chatgpt
revision of: https://t.co/BY9Jl0gysw https://t.co/UDlDvpNEMF","a barbie doll exposed absurdity beauty human condition. become symbol idealized beauty, gender stereotypes, consumer culture barbie dolls represent, loved every minute it. revision of:",0.6388888888888888,315,184,131
2023-04-08 00:34:29+00:00,ChatGPT,Early days of the net was Avatars went to #Catfishers then evolved 2 #ChatGpt next stage ? Human looking #Robots with #wifi  with internet gptChat voice ( pick your voice software ) 2 having selling that Android / Bot for Xmas ? ( sounds like #SciFi or da #EndGame aka #slaveBot?),early days net avatars went evolved 2 next stage ? human looking internet gptchat voice pick voice software 2 selling android bot xmas ? sounds like da aka,0.5434782608695652,280,155,125
2023-04-08 00:26:48+00:00,ChatGPT,"Whenever I see #ChatGPT I chuckle and think back at GIS Portal Toolkit I started developing 20 years ago. A metadata catalog you could ask ‘do you have geology data in this area for this time period?’

We called it GPT and yes, we had GPT 3… 

#HappyFriday","whenever see chuckle think back gis portal toolkit started developing 20 years ago. metadata catalog could ask do geology data area time period? called gpt yes, gpt 3",0.5454545454545454,256,166,90
2023-04-08 00:25:51+00:00,ChatGPT,"ChatGPT is an AI-powered language model developed by OpenAI. It is designed to provide helpful and informative responses to various questions. ChatGPT has the potential to advance multiple fields and create new opportunities.

#Guideconsultants #ChatGPT #AI #Technology #Science https://t.co/y0aRcAG1Lh",chatgpt aipowered language model developed openai. designed provide helpful informative responses various questions. chatgpt potential advance multiple fields create new opportunities.,0.5428571428571428,302,184,118
2023-04-08 00:23:07+00:00,ChatGPT,Here we go. Australian mayor readies world's first defamation lawsuit over #ChatGPT content. https://t.co/ntkiN95B1V,go. australian mayor readies worlds first defamation lawsuit content.,0.5333333333333333,116,69,47
2023-04-08 00:21:33+00:00,ChatGPT,"Unlock the full potential of #ChatGPT and elevate your skills to new heights.

Don't wait any longer - start mastering ChatGPT today and watch your success skyrocket!

To get this FREE guide:

1. Follow me so I can send to you 
2. Like and 
3. retweet with ""send"" https://t.co/mRqhJNC3mk",unlock full potential elevate skills new heights. wait longer start mastering chatgpt today watch success skyrocket! get free guide: 1. follow send 2. like 3. retweet send,0.5909090909090909,287,171,116
2023-04-08 00:20:57+00:00,ChatGPT,Another example of #ChatGPT making stuff up: https://t.co/mizWuZcWDz,another example making stuff up:,0.625,68,32,36
2023-04-08 00:19:03+00:00,ChatGPT,🌟 Enhance your business with cutting-edge AI technology! Our #ChatGPT for Beginners course offers the perfect introduction for companies embracing the digital world. Sign up now: https://t.co/kAF7l0d2qN #BusinessInnovation #AI https://t.co/ZEyZ6hvbFM,enhance business cuttingedge ai technology! beginners course offers perfect introduction companies embracing digital world. sign now:,0.5172413793103449,250,133,117
2023-04-08 00:18:02+00:00,ChatGPT,#Microsoft #Bing Search Exceeds 100 Million Daily Active Users for the First Time! https://t.co/WuEjvLNUiu #ChatGPT #News,search exceeds 100 million daily active users first time!,0.5625,121,57,64
2023-04-08 00:13:53+00:00,ChatGPT,"@itisprashanth Simple example
If Chatgpt replaces jobs then whole consumer market will collapse and whole corporate business will collapse. No one will allow to that happen. AI will improve and create more jobs ,stop scaring people #AI #Chatgpt #chatgpt4","simple example chatgpt replaces jobs whole consumer market collapse whole corporate business collapse. one allow happen. ai improve create jobs ,stop scaring people",0.6363636363636364,254,164,90
2023-04-08 00:13:49+00:00,ChatGPT,So our government thinks the only way to curb inflation is raise interest rates? Chat GPT says there are a few other ways. Reduce Government spending looks like a good place to start. #auspol #ai #chatgpt #inflation https://t.co/1DKWsIla1S,government thinks way curb inflation raise interest rates? chat gpt says ways. reduce government spending looks like good place start.,0.5428571428571428,239,134,105
2023-04-08 00:03:47+00:00,ChatGPT,"After both #BillGates and #ElonMusk, among others, called for a six-month halt to the development of artificial intelligence, especially after the sudden emergence of #ChatGPT to achieve profits, billions in funding, and a large number of users in a very short time, ...","among others, called sixmonth halt development artificial intelligence, especially sudden emergence achieve profits, billions funding, large number users short time,",0.5428571428571428,270,165,105
2023-04-08 00:00:31+00:00,ChatGPT,"Hey, @OpenAI, many people experimenting with #ChatGPT, including myself, note various errors or anomalous responses, and conclude these are flaws. Is it not possible, tho, that chatGPT is accurately representing how we often remember things–imperfectly &amp; wrongly?","hey, , many people experimenting including myself, note various errors anomalous responses, conclude flaws. possible, tho, chatgpt accurately representing often remember thingsimperfectly amp; wrongly?",0.5384615384615384,267,201,66
2023-04-08 00:00:02+00:00,ChatGPT,"Retweet/repost if you find this helpful:
🤖 Treat AI tools like a digital intern
🔎 Understand your needs and requirements
📝 Craft clear, well-defined prompts
🚫 Avoid assumptions and add constraints
📊 Add structure and format
🔄 Iterate and refine
#AItips #ChatGPT https://t.co/0IcG9fbVFm","retweetrepost find helpful: treat ai tools like digital intern understand needs requirements craft clear, welldefined prompts avoid assumptions add constraints add structure format iterate refine",0.5365853658536586,285,195,90
2023-04-07 23:58:21+00:00,ChatGPT,“You are the product. It's classic conditioning. Even using #ChatGPT on the free tier and constructing elaborate and more descriptive prompts is free training. We've learnt nothing from years of Facebook and other social network platforms”,you product. classic conditioning. even using free tier constructing elaborate descriptive prompts free training. learnt nothing years facebook social network platforms,0.5294117647058824,239,168,71
2023-04-07 23:44:01+00:00,ChatGPT,Looking for an automation tool to integrate web apps and automate tasks? Check out Zapier! #Zapier #chatgpt #gpt4 #aitools,looking automation tool integrate web apps automate tasks? check zapier!,0.5263157894736842,122,72,50
2023-04-07 23:40:23+00:00,ChatGPT,"You are a helpful Salesforce knowledge Bot. You answer truthfully questions that are asked about Salesforce. You refer to the Official Salesforce Documentation.

#ChatGPT  #Salesforce https://t.co/6Qm5jtRN9g",helpful salesforce knowledge bot. answer truthfully questions asked salesforce. refer official salesforce documentation.,0.5454545454545454,207,120,87
2023-04-07 23:36:36+00:00,ChatGPT,"""The newest version of ChatGPT passed the US medical licensing exam with flying colors"" -- It must be LIGHT YEARS beyond the ability of the one open to the public, because that bitch is often dumb as a brick! 🤣 #ChatGPT #OpenAI #AI #ArtificialIntelligence https://t.co/JzHvq8SGsV","the newest version chatgpt passed us medical licensing exam flying colors must light years beyond ability one open public, bitch often dumb brick!",0.5238095238095238,279,146,133
2023-04-07 23:31:35+00:00,ChatGPT,"If you're buying a car and want to know the amortization table on payments going to principal vs. interest, ChatGPT 4 does it in seconds with a table for every payment without having to go to F&amp;I. #ChatGPT","buying car want know amortization table payments going principal vs. interest, chatgpt 4 seconds table every payment without go famp;i.",0.5294117647058824,209,135,74
2023-04-07 23:31:08+00:00,ChatGPT,ChatGPT drives OpenAI to a $29B empire! 🚀 Explore the tech behind the AI giant: #OpenAI #ChatGPT #AIIndustry url,chatgpt drives openai 29b empire! explore tech behind ai giant: url,0.5263157894736842,112,67,45
2023-04-07 23:31:02+00:00,ChatGPT,🌟 Enhance your business with cutting-edge AI technology! Our #ChatGPT for Beginners course offers the perfect introduction for companies embracing the digital world. Sign up now: https://t.co/kAF7l0d2qN #BusinessInnovation #AI https://t.co/c5zMjjNlRH,enhance business cuttingedge ai technology! beginners course offers perfect introduction companies embracing digital world. sign now:,0.5172413793103449,250,133,117
2023-04-07 23:30:00+00:00,ChatGPT,"#ArtificialIntelligence chatbots like #ChatGPT are disrupting the way we work, live &amp; evolve as a nation. Are we ready for such national #security threats without the necessary safeguards being set in place? @KiranYellupula analyses https://t.co/9AHsxK8xuw","chatbots like disrupting way work, live amp; evolve nation. ready national threats without necessary safeguards set place? analyses",0.5151515151515151,260,131,129
2023-04-07 23:23:07+00:00,ChatGPT,Wasn't happy with the song request options out there. With the help of #Chatgpt fixing my sloppy code I have a functional spotify song request bot. Going to put the code out FO FREE when I feel comfortable for my other stimers. https://t.co/pBZkRanTuS,happy song request options there. help fixing sloppy code functional spotify song request bot. going put code fo free feel comfortable stimers.,0.5588235294117647,251,143,108
2023-04-07 23:21:20+00:00,ChatGPT,"Elon Musk, Steve Wozniak, and Andrew Yang are among the group of technology leaders calling for a pause in the development of AI systems that could potentially outcompete human intelligence of AI systems in general tasks. #chatgpt #TechNews Learn More https://t.co/0W5hRc9bJp https://t.co/STmjNoADhx","elon musk, steve wozniak, andrew yang among group technology leaders calling pause development ai systems could potentially outcompete human intelligence ai systems general tasks. learn",0.6388888888888888,299,185,114
2023-04-07 23:21:06+00:00,ChatGPT,I appreciate the value of #ChatGPT in initial planning to promote deeper thinking.  Connections to further creative thought promotes an #innovatormindset in opening opportunity to start with why.,appreciate value initial planning promote deeper thinking. connections creative thought promotes opening opportunity start why.,0.6,195,127,68
2023-04-07 23:18:00+00:00,ChatGPT,Get ready to maximize your #business potential with #ChatGPT! Discover 12 powerful ways to use AI effectively in your organization and streamline  operations at @KendraLeeKLA’s Coffee with Kendra webinar. RSVP now: https://t.co/mCmg7DIZya,get ready maximize potential discover 12 powerful ways use ai effectively organization streamline operations s coffee kendra webinar. rsvp now:,0.6333333333333333,238,143,95
2023-04-07 23:16:46+00:00,ChatGPT,"#ChatGPT invents sexual harassment case and names Prof? 
Bush II made up weapons of mass destruction, named an innocent leader, and destroyed a country. OK, your turn for harm from #ChatGPT.","invents sexual harassment case names prof? bush ii made weapons mass destruction, named innocent leader, destroyed country. ok, turn harm",0.6666666666666666,190,137,53
2023-04-07 23:15:36+00:00,ChatGPT,🤝💰OpenAI's plugin ecosystem can pave the way for new industries to emerge as businesses leverage language models to access and act on third-party data. The possibilities are endless! #ChatGPT #DigitalTransformation,openais plugin ecosystem pave way new industries emerge businesses leverage language models access act thirdparty data. possibilities endless!,0.5333333333333333,214,142,72
2023-04-07 23:15:21+00:00,ChatGPT,"🔍🚀 With #ChatGPT plugins, businesses can offer their services seamlessly through text or voice commands, creating a new market for efficient and intuitive customer experiences! #AI #innovation","plugins, businesses offer services seamlessly text voice commands, creating new market efficient intuitive customer experiences!",0.5555555555555556,192,128,64
2023-04-07 23:15:20+00:00,ChatGPT,"@jdrosen2 at @Five9 explores how the third era of #AI is upon us. It's almost impossible to scroll through social media these days without seeing stories about OpenAI, GPT3, Large Language Models (LLM), #ChatGPT and Bing's chat assistant. Read on. https://t.co/zqMxBR7eyX","explores third era upon us. almost impossible scroll social media days without seeing stories openai, gpt3, large language models llm, bings chat assistant. read on.",0.5348837209302325,271,165,106
2023-04-07 23:15:05+00:00,ChatGPT,"Can AI fly a plane, probably. would you want fly with AI in cockpit? Not sure, ask Frank Pool. #ChatGPT https://t.co/NbuF1ZgbyA","ai fly plane, probably. would want fly ai cockpit? sure, ask frank pool.",0.5789473684210527,127,72,55
2023-04-07 23:12:32+00:00,ChatGPT,Google CEO says ChatGPT AI rival is coming - TechRepublic https://t.co/WmW9ix9KRh #chatgpt #AI #openAI,google ceo says chatgpt ai rival coming techrepublic,0.5714285714285714,102,52,50
2023-04-07 23:04:34+00:00,ChatGPT,ChatGPT Invented Sexual Harassment Charges Against Law Professor - OutKick https://t.co/GvB434r7bU #chatgpt #AI #openAI,chatgpt invented sexual harassment charges law professor outkick,0.5714285714285714,119,64,55
2023-04-07 23:03:21+00:00,ChatGPT,"Our deep dive into whether OpenAI 's #ChatGPT plugin store could reach #AppStore monopoly status like Apple! 🍏

Key points to consider:
🚧 Distribution Exclusivity
📱 App Exclusivity
🌐 Network Effects

But, is monopoly even the right goal? 🎯💡","deep dive whether openai s plugin store could reach monopoly status like apple! key points consider: distribution exclusivity app exclusivity network effects but, monopoly even right goal?",0.631578947368421,240,188,52
2023-04-07 23:03:18+00:00,ChatGPT,"#ChatGPT makes it easy to switch domains for good programmers.

API devs can become system devs. Embedded devs can become web devs.

No longer do you have to spend hours learning a new library.  ChatGPT will give you most of what you need for the new domain in seconds.",makes easy switch domains good programmers. api devs become system devs. embedded devs become web devs. longer spend hours learning new library. chatgpt give need new domain seconds.,0.6,269,182,87
2023-04-07 22:55:23+00:00,ChatGPT,".@icreatelife I think the last time I messed with Comic Life was 2006 on my Mac. After watching your YouTube, I dove in again. Too much fun! #ChatGPT scripted it, #Midjourney did the artwork and Comic Life on the iPad brought it all together! Thanks for the inspiration! https://t.co/lV4yATCP8S",". think last time messed comic life 2006 mac. watching youtube, dove again. much fun! scripted it, artwork comic life ipad brought together! thanks inspiration!",0.5238095238095238,294,160,134
2023-04-07 22:54:46+00:00,ChatGPT,"ChatGPT to AirTable Extension! Automate ChatGPT prompt generation in AirTable to create written content, Tweets, Instagram captions, meta descriptions, page titles, and more!

https://t.co/His0D3QHhn

#chatgpt #airtable #openai","chatgpt airtable extension! automate chatgpt prompt generation airtable create written content, tweets, instagram captions, meta descriptions, page titles, more!",0.7083333333333334,227,161,66
2023-04-07 22:53:49+00:00,ChatGPT,Technology didn’t advance people. People changed so Technology could advance. #AI #ChatGPT,technology didnt advance people. people changed technology could advance.,0.5833333333333334,90,73,17
